title,excerpt,content,official_url,pricing_page_url,pricing_model,price_type,price_single_amount,price_range_low,price_range_high,billing_unit,has_free_plan,has_free_trial,trial_days,pricing_tiers_json,editor_rating_value,editor_review_summary,editor_features,editor_pros,editor_cons,category_slug,use_case,platform,ai_pricing_model,ai_billing_unit
ChatGPT,Advanced AI chatbot by OpenAI,"ChatGPT is a state-of-the-art conversational AI that can assist with writing, coding, analysis, and creative tasks. Built on GPT-4 architecture, it provides natural language understanding and generation.",https://chat.openai.com,https://openai.com/pricing,freemium,tiers,,,month,1,1,7,"[{""name"":""Free"",""amount"":0,""currency"":""USD"",""unit"":""month"",""notes"":""GPT-3.5 access""},{""name"":""Plus"",""amount"":20,""currency"":""USD"",""unit"":""month"",""notes"":""GPT-4 access, priority""},{""name"":""Team"",""amount"":25,""currency"":""USD"",""unit"":""seat_month"",""notes"":""Collaboration tools""}]",4.8,"ChatGPT sets the standard for conversational AI with impressive natural language capabilities and versatile applications.","Natural language processing|Code generation|Multi-turn conversations|Context awareness|Multiple languages","Highly capable and versatile|Free tier available|Regular updates and improvements|Large knowledge base","Can provide inaccurate information|Limited real-time data|Rate limits on free tier|Occasional capacity issues",chatbots,"Content Creation|Customer Support|Coding|Research",Web,Freemium,month
Midjourney,AI art generation from text prompts,"Midjourney is a generative AI program that creates images from textual descriptions. It excels at producing artistic, dreamlike imagery and has become popular among digital artists and designers.",https://midjourney.com,https://docs.midjourney.com/docs/plans,paid,range,10,120,month,0,0,,"[{""name"":""Basic"",""amount"":10,""currency"":""USD"",""unit"":""month"",""notes"":""~200 images/month""},{""name"":""Standard"",""amount"":30,""currency"":""USD"",""unit"":""month"",""notes"":""Unlimited relaxed""},{""name"":""Pro"",""amount"":60,""currency"":""USD"",""unit"":""month"",""notes"":""Stealth mode""},{""name"":""Mega"",""amount"":120,""currency"":""USD"",""unit"":""month"",""notes"":""Maximum fast hours""}]",4.6,"Midjourney produces stunning AI-generated art with a distinctive aesthetic style that has captivated the creative community.","Text-to-image generation|Multiple artistic styles|High-resolution outputs|Iterative refinement|Community gallery","Exceptional image quality|Unique artistic style|Active community|Regular model updates","Requires Discord|No free tier|Learning curve for prompts|Limited control over specific details",image-design,"Image Generation|Art Creation|Design",Discord,Paid,month
Grammarly,AI-powered writing assistant,"Grammarly helps improve your writing with real-time grammar, spelling, punctuation, and style suggestions. It works across multiple platforms and applications.",https://grammarly.com,https://www.grammarly.com/plans,freemium,range,12,15,month,1,1,7,,4.5,"The gold standard for grammar checking with comprehensive writing assistance and cross-platform integration.","Grammar and spell check|Style suggestions|Plagiarism detection|Tone analysis|Browser extension|Desktop apps","Easy to use|Works everywhere|Accurate suggestions|Free tier useful","Premium features expensive|Some false positives|Limited in highly technical writing",writing,"Writing|Editing|Business Communication",Web,Freemium,month
Notion AI,AI assistant built into Notion,"Notion AI integrates artificial intelligence directly into your Notion workspace, helping with writing, brainstorming, summarizing, and organizing content.",https://notion.so,https://www.notion.so/pricing,freemium,single,10,,month,1,1,,,4.3,"Seamless AI integration into an already powerful productivity platform makes Notion AI a natural choice for existing users.","Content generation|Summarization|Translation|Brainstorming|Q&A on workspace data","Integrated into Notion|Affordable|Multiple AI features|Works with existing data","Requires Notion knowledge|Less powerful than dedicated AI tools|Add-on cost to Notion subscription",productivity,"Writing|Note-taking|Project Management",Web,Freemium,month
Copy.ai,AI copywriting tool,"Copy.ai uses artificial intelligence to generate marketing copy, blog posts, social media content, and more. It's designed for marketers and content creators.",https://copy.ai,https://www.copy.ai/pricing,freemium,range,36,49,month,1,1,7,"[{""name"":""Free"",""amount"":0,""currency"":""USD"",""unit"":""month"",""notes"":""2,000 words/month""},{""name"":""Pro"",""amount"":36,""currency"":""USD"",""unit"":""month"",""notes"":""Unlimited words""},{""name"":""Team"",""amount"":49,""currency"":""USD"",""unit"":""seat_month"",""notes"":""Collaboration features""}]",4.2,"Copy.ai excels at generating marketing copy quickly, though output quality varies and requires editing.","90+ copywriting tools|Multiple languages|Brand voice|Blog wizard|Chrome extension","Fast content generation|Free tier generous|Easy to use|Good for brainstorming","Output needs editing|Can be repetitive|Limited customization|Generic tone sometimes",marketing,"Copywriting|Content Marketing|Social Media","Web,Chrome Extension",Freemium,month
GitHub Copilot,AI pair programmer,"GitHub Copilot is an AI coding assistant that suggests whole lines or entire functions right inside your editor, powered by OpenAI Codex.",https://github.com/features/copilot,https://github.com/features/copilot/plans,paid,single,10,,month,0,1,30,,4.7,"Revolutionary AI coding assistant that significantly speeds up development with intelligent code suggestions.","Code completion|Multi-language support|Context-aware|Comment-to-code|Documentation generation","Incredible time-saver|Learns your style|Supports many languages|IDE integration","Subscription cost|Sometimes wrong suggestions|Can suggest copyrighted code|Privacy concerns",coding,"Code Completion|Development|Learning","VS Code,JetBrains,Neovim",Paid,month
Jasper,AI content platform,"Jasper (formerly Jarvis) is an AI content platform designed for businesses and marketers to create high-quality content at scale.",https://jasper.ai,https://www.jasper.ai/pricing,paid,range,39,125,month,0,1,7,"[{""name"":""Creator"",""amount"":39,""currency"":""USD"",""unit"":""month"",""notes"":""1 seat, 1 brand voice""},{""name"":""Teams"",""amount"":99,""currency"":""USD"",""unit"":""month"",""notes"":""3 seats, 3 brand voices""},{""name"":""Business"",""amount"":125,""currency"":""USD"",""unit"":""seat_month"",""notes"":""Custom, unlimited brand voices""}]",4.4,"Premium AI writing platform with advanced features but higher price point. Best for businesses with serious content needs.","50+ templates|Brand voice|SEO mode|Plagiarism checker|Art generation|Team collaboration","High-quality output|Great for long-form|Brand voice training|Comprehensive features","Expensive|Learning curve|Credit-based pricing confusing|Overkill for casual use",marketing,"Content Marketing|Copywriting|SEO|Social Media",Web,Paid,month
Runway ML,AI video and image editing,"Runway ML brings AI-powered creative tools to video editors, with features like background removal, object tracking, and generative video.",https://runwayml.com,https://runwayml.com/pricing,freemium,range,12,76,month,1,1,,,4.5,"Cutting-edge AI video editing tools that democratize advanced post-production techniques.","AI video editing|Background removal|Motion tracking|Green screen|Text-to-video|30+ AI tools","Innovative features|User-friendly|Regular updates|Free tier for testing","Credits run out fast|Expensive for heavy use|Some tools still experimental|Processing can be slow",video,"Video Editing|Content Creation|Post-production",Web,Freemium,month
Descript,AI-powered audio and video editor,"Descript is a collaborative audio and video editor that uses AI for transcription, voice cloning, and filler word removal.",https://www.descript.com,https://www.descript.com/pricing,freemium,range,12,24,month,1,1,,,4.6,"Innovative approach to editing that treats audio/video like a text document. Overdub voice cloning is remarkably good.","Transcription-based editing|Voice cloning (Overdub)|Filler word removal|Multi-track editing|Screen recording|Studio sound","Revolutionary editing approach|Excellent transcription|Overdub is amazing|All-in-one solution","Overdub hours limited|Steep learning curve|Resource intensive|Export quality limits on free tier",audio-voice,"Podcast Editing|Video Editing|Transcription",Desktop,Freemium,month
Perplexity AI,AI-powered answer engine,"Perplexity AI is a conversational search engine that uses AI to provide direct answers with sources, combining search and chat capabilities.",https://www.perplexity.ai,https://www.perplexity.ai/pro,freemium,single,20,,month,1,0,,,4.4,"Excellent alternative to traditional search for research tasks, with transparent sourcing and up-to-date information.","Conversational search|Source citations|Follow-up questions|Multiple AI models|Mobile apps","Accurate answers|Cites sources|Free tier useful|Up-to-date information","Limited customization|Pro features expensive for light use|Occasional hallucinations|Search depth varies",research-platforms,"Research|Information Discovery|Q&A","Web,iOS,Android",Freemium,month